{
  "schemaVersion": "1.0",
  "projectId": "e345abb6-2092-48ec-b659-fd8478cb9492",
  "id": "module-design:mod.external-adapters",
  "revision": "1.1.0",
  "status": "approved",
  "architecture": {
    "id": "arch.do178c-audit-hub",
    "revision": "4",
    "contentHash": "9e85b23877737297bba216dd45275f490a1a042c2e11a3bdd97fc218762756c2"
  },
  "module": {
    "moduleId": "mod.external-adapters",
    "moduleVersion": "1.0.0",
    "name": "External Adapters",
    "moduleType": "connection",
    "responsibility": "Provide technology-specific, read-only access to configured lifecycle artifact formats and translate them into normalized evidence records, typed relationships, hashes, provenance, and structured diagnostics.",
    "nonResponsibilities": [
      "snapshot-publication",
      "lifecycle-interpretation",
      "finding-workflow",
      "UI-rendering",
      "source-artifact-mutation"
    ],
    "ownedConcerns": [
      "Module behavior"
    ],
    "excludedConcerns": [
      "snapshot-publication",
      "lifecycle-interpretation",
      "finding-workflow",
      "UI-rendering",
      "source-artifact-mutation"
    ]
  },
  "trace": {
    "useCaseIds": [
      "uc-package"
    ],
    "workflowNodeIds": [
      "package:export"
    ],
    "scenarioStepIds": [
      "uc-package:step:export"
    ],
    "ruleIds": [
      "rule-authority",
      "rule-local-workflow",
      "rule-snapshot",
      "rule-publish",
      "rule-fallback",
      "rule-finding",
      "rule-stale",
      "rule-phases",
      "rule-shared-anatomy",
      "rule-shared-actions",
      "rule-sample-default",
      "rule-sample-real",
      "rule-sample-badge",
      "rule-sample-overlay",
      "rule-sample-export",
      "rule-sample-portable",
      "rule-same-ui",
      "rule-objectives",
      "rule-claims",
      "rule-llr",
      "rule-coverage",
      "rule-compare",
      "rule-security",
      "rule-performance",
      "rule-determinism"
    ],
    "qualityRequirementIds": [],
    "sourceRefs": [
      "source-1",
      "source-2",
      "source-3"
    ],
    "designDecisionIds": []
  },
  "boundary": {
    "directDependencyIds": [],
    "directConsumerIds": [
      "mod.workspace-snapshots",
      "mod.assurance-workflow",
      "mod.ingestion-publication"
    ],
    "deployableId": "unassigned",
    "runtimeAllocation": "local-embedded",
    "runtimeLanguage": "typescript",
    "ownedPaths": [
      "src/modules/external-adapters/"
    ],
    "editableSharedPaths": []
  },
  "providedOperations": [
    {
      "operationId": "op.access-external-artifacts",
      "contractVersion": "1.0.0"
    }
  ],
  "requiredOperations": [],
  "schemas": [
    {
      "id": "op.access-external-artifacts.input",
      "text": "op.access-external-artifacts.input"
    },
    {
      "id": "op.access-external-artifacts.output",
      "text": "op.access-external-artifacts.output"
    }
  ],
  "rules": [
    {
      "id": "rule-authority",
      "text": "Connected engineering artifacts remain authoritative. The hub must not write changes to lifecycle files."
    },
    {
      "id": "rule-local-workflow",
      "text": "Only hub-local findings, reviews, dispositions, package selections, annotations, and sample sandbox state are editable, and every change is auditable."
    },
    {
      "id": "rule-snapshot",
      "text": "Each published snapshot is immutable and identifies exact source revisions, extraction context, and hashes."
    },
    {
      "id": "rule-publish",
      "text": "An extraction or indexing failure prevents candidate publication. An evidence gap stays visible and does not prevent a reliable snapshot."
    },
    {
      "id": "rule-fallback",
      "text": "A failed or partial refresh never replaces the last valid published snapshot."
    },
    {
      "id": "rule-finding",
      "text": "The hub calculates deterministic findings for each snapshot. Human findings keep attribution, history, disposition, and closure evidence."
    },
    {
      "id": "rule-stale",
      "text": "Evidence is stale when its source revision or dependency hash differs from the selected snapshot. Evidence is also stale after an unreviewed dependency change."
    },
    {
      "id": "rule-phases",
      "text": "The Evidence Explorer navigation is Overview, Planning, Requirements, Design, Implementation, Verification, Configuration Management, Quality Assurance, and Certification."
    },
    {
      "id": "rule-shared-anatomy",
      "text": "Every lifecycle area uses a consistent phase header, tailored subnavigation, working evidence table or visualization, evidence inspector, findings drawer, and baseline-compare mode."
    },
    {
      "id": "rule-shared-actions",
      "text": "Each evidence item provides its dossier, traces, source location, baseline comparison, source data, findings, reviews, and package controls."
    },
    {
      "id": "rule-sample-default",
      "text": "If zero real projects exist, the sample opens automatically with no picker blocker or blank dashboard."
    },
    {
      "id": "rule-sample-real",
      "text": "After a real project exists, the last real project opens by default and the sample remains selectable under Examples."
    },
    {
      "id": "rule-sample-badge",
      "text": "The sample always displays a Sample Data badge and a Connect a real project action."
    },
    {
      "id": "rule-sample-overlay",
      "text": "Bundled sample evidence is immutable. A resettable sandbox stores sample findings, reviews, dispositions, packages, and preferences."
    },
    {
      "id": "rule-sample-export",
      "text": "Every sample export is marked Synthetic sample — not certification evidence in both visible output and manifest metadata."
    },
    {
      "id": "rule-sample-portable",
      "text": "The sample uses a normalized extraction snapshot for synthetic artifacts. It must not disguise text or JSON as proprietary binary files."
    },
    {
      "id": "rule-same-ui",
      "text": "Sample projects and real projects use the same APIs, domain model, routes, and components. The product has no demo-only interface."
    },
    {
      "id": "rule-objectives",
      "text": "Do not bundle copyrighted DO-178C or DO-331 objective text. Use configurable identifiers and licensed profiles."
    },
    {
      "id": "rule-claims",
      "text": "The application may report evidence status against the configured profile but must not claim certification, regulatory approval, or compliance."
    },
    {
      "id": "rule-llr",
      "text": "Requirement classifications and allocation rules prevent ambiguous duplication between higher-level and low-level requirement views."
    },
    {
      "id": "rule-coverage",
      "text": "The hub imports coverage from authoritative results. The hub does not calculate coverage."
    },
    {
      "id": "rule-compare",
      "text": "Baseline comparison reports added, removed, changed, and stale evidence without performing semantic merge or conflict resolution."
    },
    {
      "id": "rule-security",
      "text": "Credentials and secrets are never stored in project configuration, snapshots, logs, packages, or displayed evidence."
    },
    {
      "id": "rule-performance",
      "text": "Normal browsing, filtering, search, trace navigation, dossier opening, and phase switching should usually respond within two seconds at accepted scale."
    },
    {
      "id": "rule-determinism",
      "text": "The bundled sample has deterministic identifiers, dates, people, revisions, hashes, relationships, counts, and reset behavior."
    }
  ],
  "invariants": [],
  "behavior": {
    "preconditions": [
      "The application request is valid."
    ],
    "postconditions": [
      "The module returns an observable result."
    ],
    "domainRejections": [],
    "technicalFailures": [],
    "sideEffects": [],
    "idempotency": "Not defined",
    "cancellation": "Not defined",
    "timeouts": "Not defined",
    "concurrency": "Not defined",
    "retry": "Retry only a declared technical failure.",
    "recovery": "Keep the last valid module state.",
    "emittedEvents": [],
    "consumedEvents": [],
    "stateDefinitions": [],
    "stateTransitions": [],
    "activityDefinitions": [
      {
        "id": "activity:mod.external-adapters:allocated-actions",
        "name": "Perform allocated actions",
        "refinesWorkflowNodeIds": [
          "package:export"
        ],
        "graph": {
          "id": "activity:mod.external-adapters:allocated-actions:graph",
          "name": "Perform allocated actions",
          "nodes": [
            {
              "id": "module:mod.external-adapters:initial",
              "kind": "initial",
              "label": "Initial",
              "description": "The module activity starts.",
              "refinesIds": []
            },
            {
              "id": "module:mod.external-adapters:refine:package:export",
              "kind": "call-operation",
              "label": "Export audit package",
              "description": "The module performs the allocated export audit package action.",
              "refinesIds": [
                "package:export"
              ],
              "operationId": "op.access-external-artifacts"
            },
            {
              "id": "module:mod.external-adapters:final",
              "kind": "final",
              "label": "Final",
              "description": "The module activity ends.",
              "refinesIds": []
            }
          ],
          "edges": [
            {
              "id": "activity:mod.external-adapters:edge:1",
              "fromNodeId": "module:mod.external-adapters:initial",
              "toNodeId": "module:mod.external-adapters:refine:package:export",
              "traceIds": [
                "workflow:uc-package",
                "package:export"
              ]
            },
            {
              "id": "activity:mod.external-adapters:edge:2",